,date,transc,name,qty,price,traded_pc
0,"22 Apr, 2021",Purchase,ISHARES MSCI EMERGING MARKETS ASIA ETF,Qty 232386,Price 530.2,% Traded 0.00
1,"22 Apr, 2021",Sell,ISHARES EM ASIA MAURITIUS CO,Qty 232386,Price 530.2,% Traded 0.00
2,"08 Apr, 2021",Purchase,THE MTBJ LTD. AS TRST FOR GOVERNMENT PENSION INVESTMENT FUND MTBJ400045849,Qty 1123945,Price 541.5,% Traded 0.02
3,"08 Apr, 2021",Sell,THE MTBJ LTD. AS TRST FOR GOVRNMNT PENSION INVSTMNT FUND MUTB400045794,Qty 1123945,Price 541.5,% Traded 0.02
4,"04 Mar, 2021",Purchase,VFTR C INSTITUTIONAL TOTAL INTERNATIONAL STOCK MARKET INDEX TRUST II,Qty 525007,Price 543.2,% Traded 0.01
5,"04 Mar, 2021",Sell,VANGUARD TOTAL INTERNATIONAL STOCK INDEX FUND,Qty 525007,Price 543.2,% Traded 0.01
6,"25 Feb, 2021",Purchase,VFTR C INSTITUTIONAL TOTAL INTERNATIONAL STOCK MARKET INDEX TRUST II,Qty 618156,Price 573.7,% Traded 0.01
7,"25 Feb, 2021",Sell,VANGUARD TOTAL INTERNATIONAL STOCK INDEX FUND,Qty 618156,Price 573.7,% Traded 0.01
